### ISSUE TITLE
UDP: max-connections: not sending serial data to all connections

### ISSUE THREAD

**Issue by andrewwade** [cminyard/ser2net#51]
I might be doing something wrong because I thought this worked before.
Here is my config on server:

```yaml
connection: &server
  accepter: udp,2222
  connector: serialdev,/dev/ttymxc2,115200n81,local
  options:
    max-connections: 5
```
On client Ubuntu machine. I run `socat UDP:<server ip address>:2222 -` on two different terminals and each terminal can send to the serial port on the server, but the serial data only goes to the last UDP connection to talk to it. I expected it to go to both UDP "connections" like TCP does.

tcpdump on server: (ip addresses removed)
```
00:51:37.934721 IP CLIENT.53830 > SERVER.2222: UDP, length 5
00:51:41.778652 IP 1CLIENT.53844 > SERVER.2222: UDP, length 5
00:51:44.259535 IP SERVER.2222 > CLIENT.53844: UDP, length 1
00:51:44.408302 IP SERVER.2222 > CLIENT.53844: UDP, length 1
00:51:44.581623 IP SERVER.2222 > CLIENT.53844: UDP, length 1
00:51:52.270478 IP CLIENT.53830 > SERVER.2222: UDP, length 7
00:51:54.420475 IP SERVER.2222 > CLIENT.53830: UDP, length 1
00:51:54.545983 IP SERVER.2222 > CLIENT.53830: UDP, length 1
```

**Comment by cminyard** [comment]
On Thu, May 27, 2021 at 05:59:13PM -0700, Andrew Wade wrote:
> I might be doing something wrong because I thought this worked before.
> Here is my config on server:
> 
> ```yaml
> connection: &server
>   accepter: udp,2222
>   connector: serialdev,/dev/ttymxc2,115200n81,local
>   options:
>     max-connections: 5
> ```
> On client Ubuntu machine. I run `socat UDP:<server ip address>:2222 -` on two different terminals and each terminal can send to the serial port on the server, but the serial data only goes to the last UDP connection to talk to it. I expected it to go to both UDP "connections" like TCP does.

Dang, that is a bug, actually in the gensio library.  It took me a bit
to trace it down, and it's going to be a bit difficult to fix.  It's the
result of two different optimizations I did interacting badly.

I should be able to fix this tomorrow, I just need a bit to think about
it.

-corey

**Comment by andrewwade** [comment]
Hopefully there's a work around we can do from the config file. Otherwise I'm curious what release version this bug was introduced so I can revert to an older version.

**Comment by cminyard** [comment]
On Thu, May 27, 2021 at 08:20:25PM -0700, Andrew Wade wrote:
> Hopefully there's a work around we can do from the config file.

Unfortunately not.

> Otherwise I'm curious what release version this bug was introduced so I can revert to an older version.

You would have to go back to version 1.5.3 for that.

I thought of a clean and easy fix, so that's done and pushed into the
repository on the 2.2.x and master branches.  My original thought on fix
was messier and required an API change, I was pretty sure I could come
up with something better.  Can you try it out from there?  I can do a
new release on it if you approve.

-corey

**Comment by andrewwade** [comment]
It appears to be fixed this commit.
https://github.com/cminyard/gensio/commit/c60539ec3147ad4943e0d7f478f20c093b245486

**Comment by cminyard** [comment]
On Fri, May 28, 2021 at 11:49:54AM -0700, Andrew Wade wrote:
> It appears to be fixed this commit.
> https://github.com/cminyard/gensio/commit/c60539ec3147ad4943e0d7f478f20c093b245486

It's actually the commit before that, but this change fixes an issue in
the first fix.

-corey

**Comment by andrewwade** [comment]
Thanks for fixing it so quickly. I'll keep an eye out for the v2.2.7 release.
